question,answer
What is your return policy?,You can return any product within 30 days of purchase.
How long does shipping take?,Shipping usually takes 3 to 5 business days.
Do you offer international shipping?,"Yes, we ship to many countries worldwide."
How can I track my order?,You can track your order using the tracking link sent to your email.
What payment methods do you accept?,"We accept credit cards, debit cards, and PayPal."
How can I contact customer support?,You can contact our support team via email or live chat.
Do you offer refunds?,"Yes, refunds are processed after we receive the returned item."
